<?xml version="1.0"?>
<kaEventConfig xmlns="http://kasource.org"
xmlns:xsi="http://www.w3.org/2001/XMLSchema-instance"
xsi:schemaLocation="http://kasource.org kaevent.xsd">
<events>
	<event name="s" listenerInterface="da.d.F" eventClass="da.d.Fo">
		<switchMethodResolver keywordMethod="wdd">
			<case value="INSERT" method="insertEvent"/>
			<default method="insertEvent"/>
		</switchMethodResolver>
	</event>
</events>
<channels>
	<channel name="h"><handle event="s"/></channel>
</channels>
</kaEventConfig>